{"dept":{"type":1,"dom":true,"arpt":"PHX","iso":"US","src":"KPHX"},"dest":{"type":1,"dom":true,"arpt":"MDW","iso":"US","src":"KMDW"},"tid":1,"sid":"3A3A0A58","filters":{"vip":false,"gov":false,"tfmdg":false,"callsign":false,"beacon":false},"hash":{"path":" 33.4342 -112.012 35.1013 -106.692 40.135 -92.5917 41.7861 -87.7525","arpt":"KPHX:KMDW:","pos":"-101.337:37.2868"},"attribs":80,"diverted":false,"origDest":null,"origDept":null,"counter":42,"ts":"1585253389254","radar":{"primary":false,"beacon":false,"reinforced":true,"coasting":false,"tfmdg":true,"adsb":true,"link16":false,"etd":false,"ais":false,"manual":false,"correlated":true,"sorted":false},"prevCallsign":false,"divertCheck":false,"delta":16385,"route":"KPHX./.ABQ052007..IRK.ENDEE4.KMDW/2132","path":"-106.692|35.1013*-92.5917|40.135*-87.7525|41.7861","eta":0,"callsign":"SWA2333","vip":false,"gov":false,"ga":false,"commercial":true,"acftISO":false,"iasa":false,"carrier":{"icao":"SWA","attribs":80},"tfmdgOnly":false,"sensors":"ADSB AMA-ZAB GCK-ZKC HTI-ZKC QOT-ZKC QWC-ZAB TAD-ZDV TFMDGV2","sensorList":["ADSB","AMA-ZAB","GCK-ZKC","HTI-ZKC","QOT-ZKC","QWC-ZAB","TAD-ZDV","TFMDGV2"],"prevPos":[-101.337,37.2868],"lon":-101.337,"lat":37.2868,"speed":561,"heading":59,"alt":410,"altType":1,"acftType":"B737","mode3":2665,"emergency":false,"gv":false,"domestic":true,"outbound":false,"inbound":false,"overflight":false,"foreign":false,"filter":1,"tsaIntl":false,"flags":7,"attribObj":{"idx":7,"flags":[28,32,5,0,16,1,0]},"type":"merge"}